familyNumber,applicationNumber,applicationDate,publicationNumber,publicationDate,patentName,abstract,applicant,inventor,IPC,IPC_count,CPC,CPC_count,familyMembers (appNum),geographicalExtensions,familyDates_min,familyDates_max,timeDifference,backwardCitationsESpaceRaw,backwardCitationsESpaceA,backwardCitationsESpaceB,backwardCitationsGoogle,forwardCitationsGoogle,publicationNumberGoogle
082742561,VN2021000018W,2021-10-18,WO2022170369A1,2022-08-11,"['CLAMPING DEVICE FOR WELDING SYSTEM, METHOD OF FIXING WELDED MATERIAL SHEETS AND METHOD OF ARC WELDING FOR THIN AND VERY THIN SHEETS']","The invention relates to a clamping device for welding system, a method of fixing welded material sheets and method of arc welding for thin and very thin sheets. In which, the clamping device is used for welding system including working table (1) can move up and down in vertical direction, in which the working table (1) is provided with three- dimentional concave cavity having the same size as that of lower jig (43) for fixing lower jig (43); jig assembly including upper jig (41) and lower jig (43); The first pair of claims in operating state will create pressure on upper jig (41) for fixing upper jig (41) and clamp welded material with working table (1); Second pair of clamps can move up and down in vertical direction, when going down, the second pair of clamps create pressure on welded material sheet for fixing welded material sheet on the surface of working table (1); and at least two pairs of locating pins for locating welded material sheet are provided on working table (1), in which one of the pair of locating pins is movable according to the width welded material sheet.",ANH NGUYEN VAN (VN),ANH NGUYEN VAN (VN); MANH NGO HUU (VN); AKIHISA MURATA (JP),B23K37/04; B23K9/025; B23K9/167,3,B23K37/0408 (EP); B23K37/0461 (EP); B23K9/025 (EP); B23K9/167 (EP); B23K2101/18 (EP),5,VN2021000018W,1,2022-08-11,2022-08-11,0,0,0,0,0,0,
082851582,IB2022056864W,2022-07-26,WO2023007358A1,2023-02-02,['MICROBIAL COMPOSITION AND MICROORGANISM-BASED METHOD OF MANUFACTURING AND TREATING OF ANIMAL FARMS USING OF THE SAME'],"A microbial composition for improving the conditions in animal farms comprising: a slow-releasing carrier base having a first predetermined percentage by weight (w/w %); and a mixture of microorganisms identified in a 16S rRNA gene sequence so that the composition is capable of denitrification, feces decomposition, and hydrogen sulfide (H2S) oxidation.",BUI HONG QUAN (VN); LUU HUYEN TRANG (VN),BUI HONG QUAN (VN); LUU HUYEN TRANG (VN),A01N63/20; A23L5/20; C12N1/14; C12N1/20,4,"A01K1/0152 (EP); A01K1/0154 (EP); A01K1/0155 (EP); A23L5/28 (EP); C12N1/14 (EP); C12N1/20 (EP,US); C12R2001/125 (US); C12R2001/23 (US); C12R2001/245 (US); C12R2001/25 (US); C12R2001/465 (US)",11,IB2022056864W; US202117387048A,2,2023-02-02,2023-02-16,0,0,0,0,0,0,
082851889,US202016920561A,2020-07-03,US11423198B2,2021-07-08,['Aerodynamic designing method of the central section of small size gas turbine engines'],"This invention proposes the aerodynamic designing method for the central section of small size gas turbine engine type and it includes the following 8 steps: 1<hi rend=""superscript"">st </hi>step: checking to confirm if compressor outlet air meets demand specified by the central section; 2<hi rend=""superscript"">nd </hi>step: estimating the inner casing diameter based on practical experience; 3<hi rend=""superscript"">rd </hi>step: estimating the outer casing diameter; 4<hi rend=""superscript"">th </hi>step: estimating the combustor dome height and combustor length; 4<hi rend=""superscript"">th </hi>step: estimating the combustor dome height and combustor length; 5<hi rend=""superscript"">th </hi>step: estimating the combustor inner and outer liner diameters; 6<hi rend=""superscript"">th </hi>step: estimating the exit inner and exit outer diameters of the pre-diffuser; 7<hi rend=""superscript"">th </hi>step: estimating the dump gap; 8<hi rend=""superscript"">th </hi>step: verifying rotordynamic properties to determine if the shaft diameter assumption starting in the 2<hi rend=""superscript"">nd </hi>step is good enough.",VIETTEL GROUP (VN); VIETTEL GROUP (VN),NGUYEN TRUONG GIANG (VN); NGUYEN QUANG HAI (VN); BUI XUAN LONG (VN); PHAM VAN SON (VN); NGUYEN TRUONG GIANG (VN); NGUYEN QUANG HAI (VN); BUI XUAN LONG (VN); PHAM VAN SON (VN),G06F30/15; G06F30/20; G06F30/17,3,"G06F30/15 (EP,US); G06F30/17 (US); G06F30/20 (EP,US); Y02T90/00 (EP)",4,US202016920561A,1,2021-07-08,2022-08-23,13,0,0,0,0,0,
082898538,DE202022103801U,2022-07-07,DE202022103801U1,2022-08-02,Ein intelligentes Finanzverwaltungssystem für E-Commerce-Websites zur Analyse von Preisen und Gewinnen durch maschinelles Lernen,"Ein intelligentes Finanzmanagementsystem (10) für E-Commerce-Websites zur Analyse von Preis und Gewinn unter Verwendung eines maschinellen Lernansatzes, wobei das System Folgendes umfasst:eine Preisdatenbank (1) umfasst eine Liste angepasster Preise für ein Produkt, wobei der Preis des Produkts mit autorisierter Modifikation oder Hinzufügen des Preises oder Ändern des Preises über einen Maschinenalgorithmus auf der Grundlage von Nachfrage und Angebot auf E-Commerce-Websites variiert;eine Einheit zur Verwaltung von E-Commerce-Aktivitäten (2), die dazu dient, Informationen über Kundeninteraktionen mit der Website eines Einzelhändlers in Bezug auf E-Commerce vom Einzelhändler zu erhalten;eine Produktpreisanalyseeinheit (3), die Informationen über die Preise ähnlicher Produkte sammelt, die in der Preisdatenbank (1) gespeichert sind, diese Preise anpasst, um sie so wettbewerbsfähig wie möglich zu machen, indem sie eine Reihe von eingebauten Regeln verwendet, und dann die aktualisierten Preise in den eigenen Shop des Verkäufers auf dem Webserver einstellt; undeine Prozessoreinheit (4), die mit dem Speicher, einer Preisdatenbank (1) und einem E-Commerce-Website-Portal (5) und einem Netzwerk verbunden ist, wobei die Prozessoreinheit (4) kommunikativ mit dem Computerspeicher und der Netzwerkschnittstelle gekoppelt ist, wobei der Prozessor verwendet wird, um eine Anfrage zur Durchführung der E-Commerce-Transaktion von der Verkäufer-Website zu senden, wobei die Anfrage eine Kontaktinformation undeine E-Mail-Adresse des Kunden und eine Transaktionsinformation enthält, wobei die Prozessoreinheit (4) die von der Produktpreisanalyseeinheit (3), der Preisdatenbank (1) und der E-Commerce-Aktivitätsmanagementeinheit (2) empfangenen Daten unter Verwendung eines angepassten maschinellen Lernmoduls verarbeitet und den Preis und den Gewinn für den Einzelhändler entsprechend den Kosten für den Einzelhändler berechnet.",ALEMRAN AHMED (IQ); DIXIT CHANDRA KUMAR (IN); GUPTA SHASHI KANT (IN); HARALAYYA BHADRAPPA (IN); HUSAIN FIROZ (IN); KARRAS DIMITRIOS A (AL); KHAN ABDUL TAYYAB (IN); KHAN IMRAN ULLAH (IN); PATHAK ANCHAL (ET); SINGH HEMANT KUMAR (IN); SINGH PRABHDEEP (IN); TRAN TIEN ANH (VN),,G06Q30/00; G06Q30/02; G06Q30/06,3,G06Q30/0206 (EP); G06Q30/0601 (EP),2,DE202022103801U,1,2022-08-02,2022-08-02,0,0,0,0,0,0,
082899740,US202217667688A,2022-02-09,US2022270225A1,2022-08-25,['DEVICE BASED ON MACHINE LEARNING'],"An image processing device includes a convolutional neural network (CNN) architecture configured to perform at least one of denoising, deblurring, dehazing, and color correction on an input. The input comprises a plurality of low-quality input images having different exposure values captured for the same object at the same time by a camera under display (CUD) to render a high-quality output image. The CNN architecture is trained using a set of training images including a plurality of low-quality training images having different exposure values and a high-quality training image corresponding to the plurality of low-quality training images.",VINAI ARTIFICIAL INTELLIGENCE APPLICATION AND RES JOINT STOCK COMPANY (VN),PHAM CUONG CAO (VN); PHAM TU VAN (VN); NGUYEN DUNG TRI (VN),G06T3/00; G06T3/40; G06T5/00; G06T5/50; G06T7/30; G06T7/90,6,"G06T3/18 (US); G06T3/4046 (US); G06T5/50 (US); G06T5/60 (EP); G06T5/70 (US); G06T5/73 (US); G06T7/30 (US); G06T7/90 (EP,US); G06T2207/10024 (EP,US); G06T2207/10144 (US); G06T2207/20081 (EP,US); G06T2207/20084 (EP,US); G06T2207/30196 (US)",13,US202217667688A,1,2022-08-25,2022-08-25,0,0,0,0,0,0,
083006236,JP2020019816W,2020-05-19,WO2020235569A1,2020-11-26,['CONNECTION OF CONCRETE-FILLED STEEL TUBE COLUMN AND REINFORCED CONCRETE SLAB'],"Disclosed is a connection of a CFT column and an RC slab that can resist larger vertical loads imposed on the RC slab. A connection of a steel tube column 10 infilled with concrete 12 and an RC slab 20 is provided. A plurality of ribs 30 are connected to the steel tube column 10 through slits 14 provided in the steel tube column 10, such that the largest planes of the ribs coincide with a substantially vertical plane. Each of the ribs 30 has two parts, one part being located inside the steel tube column 10 and the other part being located outside the steel tube column 10. A bearing steel plate 40 is connected to the outer circumferential surface of the steel tube column 10 and to the upper ends of the ribs 30, such that the largest plane of the bearing steel plate coincides with a substantially horizontal plane. The RC slab 20 is mounted on the bearing steel plate 40. Each of the ribs 30 has at least one first through-hole 32 in the one part located inside the steel tube column 10.",JFE STEEL CORP (JP); HCMUT HO CHI MINH CITY UNIV OF TECHNOLOGY VNU HCM (VN),NAKAGAWA KEI (JP); KAMURA HISAYA (JP); ISHII TAKUMI (JP); NANBA TAKAYUKI (JP); OKI KOJI (JP); NGO-HUU CUONG (VN),E04B1/30; E04B1/58; E04B5/43,3,E04B1/165 (EP); E04B5/43 (EP); E04C5/0645 (EP),3,JP2020019816W; JP2020560295A,1,2020-11-26,2022-08-25,21,0,0,0,0,0,
083006777,US202017638052A,2020-07-20,US2022273747A1,2022-09-01,"['NATURAL ESSENTIAL OIL COMPOSITION FOR RELAXING NERVES, SLEEPING WELL AND PREVENTING COLD AND FLU']","The present invention provides a natural essential oil composition for relaxing nerves, sleeping well and preventing cold and flu. The composition comprises holy basil, lemongrass, patchouli, old coriander seeds, and tangerine peels, wherein the amount (wt %} of holy basil essential oil is about: 0.1% to about 60%; the amount (wt %) of lemongrass essential oil is about 0.1% to about 55; the amount (wt %) of patchouli essential oil is about 0.1% to about 30%; the amount: (wt %) of essential oil of old coriander seeds is about 0.1 to about 50% and the amount (wt %) of essential oil of tangerine peels is about 0.1% to about 50%. The composition of the present invention further comprises additional essential oils for further use purposes. The composition also comprises carrier oils and solvents for adjusting suit able concentrations of the composition.",SUNSTAR JOINT STOCK COMPANY (VN),NGUYEN THI HUONG LIEN (VN),A61K36/23; A61K36/282; A61K36/53; A61K36/534; A61K36/61; A61K36/752; A61K36/899,7,"A61K36/23 (EP,US); A61K36/282 (EP,US); A61K36/53 (EP,US); A61K36/534 (EP,US); A61K36/61 (EP,US); A61K36/752 (EP,US); A61K36/899 (EP,US)",7,US202017638052A,1,2022-09-01,2022-09-01,0,0,0,0,0,0,
083059558,CA207552F,2021-10-01,CA207552S,2023-01-24,['BATH TUB'],,HAI SON BUI DUONG (VN),,,0,,0,CA207552F; JP2021502106F; TW110305376F,3,2022-03-21,2023-01-24,10,0,0,0,0,0,
083059558,TW110305376F,2021-10-05,TWD217936S,2022-03-21,['BATHTUB'],﻿【物品用途】;本案設計應分類為LOC(13)Cl.23-06。;【設計說明】;後視圖與前視圖相同，故省略後視圖。右側視圖與左側視圖相同，故省略右側視圖。俯視圖2移除部分以顯示內部。,布伊 杜昂 海森 (VN); BUI DUONG HAI SON,BUI DUONG HAI SON,,0,,0,CA207552F; JP2021502106F; TW110305376F,3,2022-03-21,2023-01-24,10,0,0,0,0,0,
083059589,CA207551F,2021-10-01,CA207551S,2023-01-24,['BATH TUB'],,HAI SON BUI DUONG (VN),,,0,,0,CA207551F; JP2021502105F; TW110305377F,3,2022-03-21,2023-01-24,10,0,0,0,0,0,
083059589,TW110305377F,2021-10-05,TWD217937S,2022-03-21,['BATHTUB'],﻿【物品用途】;本案設計應分類為LOC(13)Cl.23-06。;【設計說明】;俯視圖2移除部分以顯示內部。,布伊 杜昂 海森 (VN); BUI DUONG HAI SON,BUI DUONG HAI SON,,0,,0,CA207551F; JP2021502105F; TW110305377F,3,2022-03-21,2023-01-24,10,0,0,0,0,0,
083060698,ZA202205045A,2022-05-09,ZA202205045B,2022-08-31,['COMPOSITE FEED ATTRACTANT FOR IMPROVING FOOD INTAKE OF TRACHINOTUS OVATUS AND PREPARATION METHOD THEREOF'],,SHENG LONG BIO TECH INT CO LTD (VN); UNIV SHANGHAI OCEAN (CN),HU HAIBIN (VN); LI SONGLIN (VN); MEI YIQIANG (VN); YUN BIAO (VN); QIAN XUEQIAO (VN); LI YANXIAN (VN); LIU JINTAO (VN); LI WANRU (VN); CUI XIANJUN (VN); ZHUANG JIECHENG (VN); WANG AN (VN); YU HONGCHANG (VN); TENG JIANFU (VN); WANG ZIXIONG (VN),,0,,0,ZA202205045A,1,2022-08-31,2022-08-31,0,0,0,0,0,0,
083060707,ZA202205046A,2022-05-09,ZA202205046B,2022-08-31,"['PUFFED COMPOUND FEED FOR IMPROVING GROWTH, FOOD INTAKE AND SURVIVAL OF MIDDLE-ADULT FISH OF TRACHINOTUS OVATUS']",,SHENG LONG BIO TECH INT CO LTD (VN),HU HAIBIN (VN); LI YANXIAN (VN); LIU JINTAO (VN); WANG AN (VN); YU HONGCHANG (VN); LI WANRU (VN); YUN BIAO (VN); QIAN XUEQIAO (VN); ZHUANG JIECHENG (VN); MEI YIQIANG (VN); WU JIANGHUA (VN),,0,,0,ZA202205046A,1,2022-08-31,2022-08-31,0,0,0,0,0,0,
083062781,TW110211190U,2021-09-23,TWM627566U,2022-06-01,['Protection device set for externally connected cylinder of sparkling water machine'],,HOANG THI KHUYEN (VN),HUANG SHI-QUAN (TW),B65D85/00,1,,0,TW110211190U,1,2022-06-01,2022-06-01,0,0,0,0,0,0,
083063165,TW111201590U,2022-02-16,TWM628257U,2022-06-11,['Fabric with embossed effect'],"A fabric with embossed effect includes a first textile unit, a second textile unit, a weaving unit and a filling. The second textile unit is connected to the first textile unit, there is a fill space between the first textile unit and the second textile unit, and the filling is disposed in the fill space. The weaving unit is connected to and is weaved between the first textile unit and the second textile unit. The weaving unit is a heat shrinking material. The fabric with embossed effect has a plane part and an embossed part. At the plane part, the weaving unit is weaved between the first textile unit and the second textile unit. At the embossed part, the weaving unit is weaved on the second textile unit, but not weaved on the first textile unit. Therefore, with the heat shrinking characteristic and the special structure configuration of the weaving unit, the embossed effect on the surface of the fabric can be obtained.",PAIHONG VIETNAM COMPANY LTD (VN),CHENG KUO-IAN (TW); SHIH YI-LIANG (TW); SHEN CHIN-LANG (TW); TSENG KUAN-YU (TW),A41H42/00; D03D15/567; D06C23/04,3,,0,TW111201590U,1,2022-06-11,2022-06-11,0,0,0,0,0,0,
083103238,ZA202205047A,2022-05-09,ZA202205047B,2022-08-31,['DEDICATED COMPOUND FEED FOR TRACHINOTUS OVATUS DURING LOW TEMPERATURE PERIOD'],,SHENG LONG BIO TECH INT CO LTD (VN); UNIV SHANGHAI OCEAN (CN),HU HAIBIN (VN); LI WANRU (VN); CUI XIANJUN (VN); ZHUANG JIECHENG (VN); LI JI (VN); MEI YIQIANG (VN); LI YANXIAN (VN); LIU JINTAO (VN); WANG AN (VN); YU HONGCHANG (VN); LI SONGLIN (VN); YUN BIAO (VN); QIAN XUEQIAO (VN),,0,,0,ZA202205047A,1,2022-08-31,2022-08-31,0,0,0,0,0,0,
083114680,DE202022104409U,2022-08-03,DE202022104409U1,2022-08-16,Ein IOT-fähiges Gerät zur Warnung von Menschen vor elektrisch kurzgeschlossenen Masten an öffentlichen Plätzen,"Ein IOT-fähiges Gerät zum Warnen von Personen vor elektrisch kurzgeschlossenen Masten an öffentlichen Orten, das in die Masten im öffentlichen Bereich einzubauen ist, alarmiert die Personen in der Nähe und alarmiert auch die nahe gelegene Elektrizitätsabteilung in einem kurzen Zustand; wobei der Erfassungsknoten eine Recheneinheit zum Ausführen aller gewünschten Aufgaben wie angegeben unter Verwendung der Bordalgorithmen, eine Stromerfassungseinheit zum Erfassen des Vorhandenseins von Strom im Mast, ein GSM-Modul zum Benachrichtigen der Elektrizitätsabteilung über den Fehler und seinen Ort umfasst , und ein Summer, um die Menschen in der Nähe zu warnen.",ANANTH CHRISTO (IN); JAMES AARON (IN); JUSTIN SHEKAINA (IN); KANAGAMANI NAGARAJAN (IN); MEENAKSHI SUNDARAM KAMESWARI (IN); NAYYAR ANAND (VN); RATHINASABAPATHY RAMADEVI (IN); SRIDHARAN NARENDRAN (IN); VELUSAMY JAYARAJ (IN),,G01R19/00; G08B21/00; G08B21/02,3,G01R19/15 (EP); G01R31/52 (EP); G08B21/02 (EP),3,DE202022104409U,1,2022-08-16,2022-08-16,0,0,0,0,0,0,
083163605,US202217742807A,2022-05-12,US2022408764A1,2022-12-29,['PROCESS FOR PRODUCING INSTANT NOODLES AND AN INSTANT NOODLE PRODUCT FROM DRAGON FRUIT PULP USING ULTRA-SONICATION TECHNOLOGY'],"The present invention provides a process for producing instant noodles and an instant noodle product from dragon fruits using ultra-sonication technology, wherein the process comprises: a) Pre-processing dragon fruit ingredients; b) Heating the dragon fruit solution to room temperature; c) Activating the dragon fruit solution; d) Removing impurities of the powdery ingredients through a sieve; e) Performing a catalytic reaction between the activated dragon fruit solution and other ingredients of the instant noodles; f) Proofing; g) Pressing the dough; h) Shape cutting into noodles; i) Steaming instant noodles; j) Macerating with seasonings; k) Cooling and frying (instant noodle product from dragon fruits using ultra-sonication technology with frying); 1) Cooling and drying (instant noodle product from dragon fruits using ultra-sonication technology without frying); m) Cooling; n) Drying and cooling; o) Packaging.",LE QUANG HUY (VN),LE QUANG HUY (VN),A23L29/00; A23L29/212; A23L29/238; A23L29/269; A23L5/30; A23L7/113,6,"A23L19/09 (EP,CN); A23L29/015 (EP,US); A23L29/035 (US); A23L29/212 (EP,US); A23L29/238 (EP,US); A23L29/27 (EP,US); A23L33/10 (CN); A23L5/32 (EP,CN,US); A23L7/113 (EP,CN,US); A23V2002/00 (CN)",10,CN202210691209A; US202217742807A; VN2022000005W,3,2022-09-13,2023-01-05,4,0,0,0,0,0,
083163605,VN2022000005W,2022-06-27,WO2023279122A1,2023-01-05,['A PROCESS FOR PRODUCING INSTANT NOODLES AND AN INSTANT NOODLE PRODUCT FROM DRAGON FRUIT PULP USING ULTRA-SONICATION TECHNOLOGY'],"The present invention provides a process for producing instant noodles and an instant noodle product from dragon fruits using ultra-sonication technology, wherein the process comprises: a) Pre-processing dragon fruit ingredients; b) Heating the dragon fruit solution to room temperature; c) Activating the dragon fruit solution; d) Removing impurities of the powdery ingredients through a sieve; e) Performing a catalytic reaction between the activated dragon fruit solution and other ingredients of the instant noodles; f) Proofing; g) Pressing the dough; h) Shape cutting into noodles; i) Steaming instant noodles; j) Macerating with seasoning; k) Cooling and frying; l) Cooling and drying; m) Cooling; n) Drying and cooling; o) Packaging.",HUY LE QUANG (VN),HUY LE QUANG (VN),A23L19/00; A23L27/00; A23L3/36; A23L3/40; A23L5/10; A23L5/20; A23L5/30; A23L7/109,8,"A23L19/09 (EP,CN); A23L29/015 (EP,US); A23L29/035 (US); A23L29/212 (EP,US); A23L29/238 (EP,US); A23L29/27 (EP,US); A23L33/10 (CN); A23L5/32 (EP,CN,US); A23L7/113 (EP,CN,US); A23V2002/00 (CN)",10,CN202210691209A; US202217742807A; VN2022000005W,3,2022-09-13,2023-01-05,4,0,0,0,0,0,
083271696,US202016732896A,2020-01-02,US11448661B2,2020-07-09,['Coaxial Angular Velocity Sensor System'],"The Coaxial Angular Velocity Sensor System is an electronic sensor, which processes and supplies the output signal of the inertial angular velocity with high accuracy and great reliability. The device consists of the main components: angular velocity sensor, analog-digital converter, microcontroller, temperature sensor, power source, mechanical anti-noise-proof chassis. The device's microprocessor comes with a signal processing algorithm that helps increase the accuracy of the device's output. Because of its compact size, high precision, and low cost, the device is used in high precision devices such as UAV cameras, or in life applications such as self-balancing vehicles.",VIETTEL GROUP (VN); VIETTEL GROUP (VN),MAC LUU PHONG (VN); NGUYEN VAN TAM (VN); DUONG DUC BANG (VN); PHAM VAN TIEN (VN); MAC LUU PHONG (VN); NGUYEN VAN TAM (VN); DUONG DUC BANG (VN); PHAM VAN TIEN (VN),G01P3/48; G01P3/489,2,G01C19/5776 (EP); G01C19/5783 (EP); G01C21/166 (EP); G01P3/4802 (US); G01P3/489 (US); G01P15/14 (US),6,US202016732896A,1,2020-07-09,2022-09-20,26,0,0,0,0,0,
083282887,DE202022104275U,2022-07-28,DE202022104275U1,2022-08-25,System für intelligentes Ressourcenmanagement für verteilte Maschinenlernaufgaben,"Ein System (10) für intelligentes Ressourcenmanagement für verteilte maschinelle Lernaufgaben, wobei das System umfasst:ein Ressourcenanforderungs-Eingabemodul (1), das so konfiguriert ist, dass es eine Anforderung für ein Ressourcenverwaltungsprodukt empfängt;ein Funktionsmodul für maschinelles Lernen (2), das so konfiguriert ist, dass es ein oder mehrere Ensembles für maschinelles Lernen ausführt, um eine oder mehrere Prioritäten für verteilte maschinelle Lernaufgaben für das Ressourcenmanagementprodukt vorherzusagen;eine Aufgabenkomponente (3), die so konfiguriert ist, dass sie ein oder mehrere Pakete an ein oder mehrere andere Internet-der-Dinge-Module auf einer verteilten Datenbank für maschinelles Lernen mit verteiltem maschinellem Lernen übermittelt;eine Paket-Warteschlange (4) für Aufgaben des verteilten maschinellen Lernens, die die ein oder mehreren Pakete für Aufgaben des verteilten maschinellen Lernens in der Datenbank für Aufgaben des verteilten maschinellen Lernens speichert;eine Warteschlange (5) für die Ressourcenverwaltung, in der die Ressourcen zur Weiterleitung an die Warteschlange für verteilte maschinelle Lernaufgaben gespeichert werden; undein Ergebnismodul (6), das so konfiguriert ist, dass es innerhalb des Ressourcenverwaltungsprodukts einen nativen Zugriff auf die eine oder mehrere Aufgabenprioritäten des verteilten maschinellen Lernens durch ein computergestütztes Modell (61) bereitstellt, das von einem Server unter Verwendung einer optimalen Ressourcennutzung in den verfügbaren Ressourcen unter Verwendung von verarbeiteten Daten aus dem Ressourcenanforderungs-Eingabemodul (1), dem Funktionsmodul des maschinellen Lernens (2), der Aufgabenkomponente (3), der Warteschlange für verteilte maschinelle Lernaufgaben (4) und der Warteschlange für die Ressourcenverwaltung verarbeitet wird.",ALEMRAN AHMED (IQ); DIXIT CHANDRA KUMAR (IN); GUPTA SHASHI KANT (IN); HARALAYYA BHADRAPPA (IN); PATHAK ANCHAL (ET); RAO MANOJ KUMAR (IN); SHARMA ANSHUL (IN); SINGH MAHESH (ET); SINGH PRABHDEEP (IN); SOMANI PARIN (GB); TAHILYANI SHAILENDRA (IN); TRAN TIEN ANH (VN),,G06F9/50; G06N3/08,2,G06F9/5038 (EP); G06N20/00 (EP),2,DE202022104275U,1,2022-08-25,2022-08-25,0,0,0,0,0,0,
083363801,US202217837205A,2022-06-10,US2022311567A1,2022-09-29,['METHOD AND SYSTEM FOR WIRELESS COMMUNICATION'],"The present invention relates to a method and a system for wireless communication. A method and a system according to the present invention is implemented by a node, a gateway, and a server. The nodes and the gateway communicating with each other via an improved LoRaWAN protocol for extending further functions of the gateway, such as data processing or the same, result in computing requirements decreasing at the server, reducing in time and several communicating procedures among network components, thus enhancing the efficiency for using network resources.",TRAN VINH QUANG (VN); HANOI UNIV OF SCIENCE AND TECHNOLOGY (VN),TRAN VINH QUANG (VN),H04L1/00; H04L5/00,2,"H04L1/0061 (EP,US); H04L5/0044 (US); H04L5/0053 (US); H04W28/02 (EP); H04W4/021 (EP); H04W88/16 (EP,US); Y02D30/70 (EP)",7,US202217837205A,1,2022-09-29,2022-09-29,0,0,0,0,0,0,
083363899,US202217837277A,2022-06-10,US2022312552A1,2022-09-29,['GATEWAY FOR USE IN WIRELESS COMMUNICATION'],"The present invention relates to a gateway for use in wireless communication. The gateway according to the present invention is to wireless communicate with nodes and a server. The nodes and the gateway communicating with each other via an improved LoRaWAN protocol for extending further functions for the gateway, such as data processing or the same, result in computing requirements decreased at the server, reducing in time and several communicating procedures among network components, thus enhancing the efficiency for using network resources.",TRAN VINH QUANG (VN); HANOI UNIV OF SCIENCE AND TECHNOLOGY (VN),TRAN VINH QUANG (VN),H04L1/00; H04L45/74; H04W88/16,3,"H04L1/0061 (US); H04L45/74 (EP,US); H04W88/16 (US); H04L1/16 (EP); H04L1/1867 (EP)",5,US202217837277A,1,2022-09-29,2022-09-29,0,0,0,0,0,0,
