familyNumber,applicationNumber,applicationDate,publicationNumber,publicationDate,patentName,abstract,applicant,inventor,IPC,IPC_count,CPC,CPC_count,familyMembers (appNum),geographicalExtensions,familyDates_min,familyDates_max,timeDifference,backwardCitationsESpaceRaw,backwardCitationsESpaceA,backwardCitationsESpaceB,backwardCitationsGoogle,forwardCitationsGoogle,publicationNumberGoogle
075586452,US201816006862A,2018-06-13,US2021121305A1,2021-04-29,['UNITARY PROSTHETIC FOOT AND METHOD OF MANUFACTURING THE SAME'],"A prosthetic foot and method of fabricating the same is disclosed which includes a socket assembly configured to connect to a natural limb of a patient, a sideway cylindrical ankle joint having a maze-like internal structure laterally affixed to the socket assembly; a foot assembly, laterally affixed to the sideway cylindrical ankle joint, having a dorsal portion, a phalange portion, a sole portion, and a heel portion; the phalange portion having a first end connected to the dorsal portion and a second end connected to the sole portion, the sole portion having a curve shape and connected to the heel portion; and the heel portion having a spring assembly connected to said cylindrical ankle joint.",DAO PHONG THANH (VN); NGUYEN THANG TAN (VN); LE GIANG HIEU (VN); BUI TUAN MANH (VN); TON DUC THANG UNIV (VN),DAO PHONG THANH (VN); NGUYEN THANG TAN (VN); LE GIANG HIEU (VN); BUI TUAN MANH (VN),A61F2/50; A61F2/66; A61F2/80; B33Y80/00,4,"A61F2/5046 (EP,US); A61F2/6607 (EP,US); A61F2/80 (EP,US); B33Y80/00 (EP,US); A61F2002/5055 (EP,US); A61F2002/5072 (US); A61F2002/5075 (EP,US); A61F2002/6635 (EP,US); A61F2002/6692 (EP,US)",9,US201816006862A,1,2021-04-29,2021-04-29,0,0,0,0,0,0,
075686139,US202017084316A,2020-10-29,US2021131767A1,2021-05-06,['System Optimizing Control Coefficients Of Flight Object Under Complex Environmental Effects Using Hybrid Fuzzy Logic And Pid Variant Controller'],"The invention presents a system optimizing control coefficients of flight object under complex environmental effects using hybrid Fuzzy Logic and PID variant controller. The proposed system includes: target module, seeker module, guidance module, control module, dynamics module. The fuzzy logic controller is applied to determine the parameters coefficients of a proportional integral derivative (PID) based on the effect of these coefficients on the system response. The control module is less affected by the accuracy of the mathematical model and can perform well in environments with impact noise.",VIETTEL GROUP (VN),TRAN VAN DUC (VN); NGUYEN TIEN DAT (VN); NGUYEN THI ANH (VN),F41G7/00; F41G7/22; G06N7/02,3,"F41G7/006 (US); F41G7/2226 (EP,US); F41G7/2246 (US); G05D1/107 (EP); G06N7/023 (EP,US)",5,US202017084316A,1,2021-05-06,2021-05-06,0,0,0,0,0,0,
075688614,US201916676422A,2019-11-06,US11334570B2,2021-05-06,['ELECTRONIC MEDICAL RECORDS SYSTEM'],"An electronic medical records (EMR) system that enables a user to import paper-based clinical form templates (typically Word documents) and insert data tags in the data fields on the templates. This approach allows the user to retrieve clinical data from user inputs and from hospital recordkeeping systems, such as HIS, LIS, RIS/PACS, and others to generate EMR forms. Medical personnel can then access the data to generate descriptive, predictive, or prescriptive analytics including vital sign charts, drug interaction warnings, and drug recommendations. The system also enables secure data sharing between healthcare facilities using a blockchain system or a FHIR server. Upon signing an EMR form with one or more electronic signatures, the system generates a digitized image including images of the electronic signatures. The system generates hash of the digitized image and store the hash to the blockchain system, wherein the hash is used to verify the signed EMR form.",NGUYEN FRANCIS TUAN ANH (US); NGUYEN FRANCIS TUAN ANH (VN); INFOMED VIET NAM,NGUYEN FRANCIS TUAN ANH (VN); NGUYEN DUY VU MINH (VN); NGUYEN FRANCIS TUAN ANH (VN); NGUYEN DUY VU MINH (VN),G06F16/21; G06F16/23; G06F16/2457; G16H10/60; H04L9/06; H04L9/32,6,"G06F16/211 (US); G06F16/2379 (US); G06F16/24573 (US); G16H10/60 (EP,US); H04L9/0643 (US); H04L9/3239 (EP); H04L9/3247 (EP,US); H04L9/50 (EP); G16H50/20 (EP); H04L9/50 (US)",10,US201916676422A,1,2021-05-06,2022-05-17,12,0,0,0,0,0,
075690739,VN2021000008W,2021-04-02,WO2021207771A1,2021-10-14,['PORTABLE COLD PLASMA STERILIZATION DEVICE'],"The invention related to the portable cold plasma sterilization device to effectively and quickly sterilize the porous tools and objects for health protection against infections such as daily face masks, gloves, bandages, gauzes, makeup sponge, makeup brush, etc. The device according to the invention includes a power supply unit connected to a high voltage pulse generating system (1), a sterilization part (2) containing a plasma generator (2.1) according to the principle of Dielectric Barrier Discharge (DBD) on the mesh electrode (2.2).",LUONG THI HONG LIEN (VN),LUONG THI HONG LIEN (VN),A61L2/14; H05H1/24,2,A61L2/14 (EP); H05H1/2406 (EP); A61L2202/122 (EP); A61L2202/16 (EP),4,VN2021000008W,1,2021-10-14,2021-10-14,0,0,0,0,0,0,
075769651,IB2021053408W,2021-04-26,WO2021240262A1,2021-12-02,['DISPLAY METHOD AND ELECTRONIC DEVICE USING THE SAME'],"A display method adapted for an electronic device is provided. The method includes: identifying a target location of the last triggered target point on a screen, wherein the target point is triggered by an input operation applied on an I/O device of the electronic device; setting, according to an identified preset dividing pattern, a target dividing line on the screen based on the target location; identifying, according to an identified preset covering pattern, a target region and one or more non-target regions other than the target region of the screen based on the target dividing line; and adjusting the one or more non-target regions of the screens to decrease the readability of the one or more non-target regions.",TCHEN THUAN THIEN (VN),TCHEN THUAN THIEN (VN); LIN CHING CHEN (TW); LIN CHIH YU (TW),G06F3/0481; G06F3/0483; G06F3/0484; G06F3/0488,4,"G06F3/0481 (US); G06F3/04812 (EP); G06F3/0483 (EP); G06F3/04842 (EP,US); G06F3/04883 (US); G06F3/04886 (EP); G06F3/0488 (EP)",7,CN202180037273A; IB2021053408W; JP2022573270A; US202016883964A,4,2021-12-02,2023-06-26,18,0,0,0,0,0,
075829137,AU2021101576A,2021-03-27,AU2021101576A4,2021-05-13,['An artificial intelligence based system to identify the medical condition prior to doctor consultation'],"The present invention relates to an artificial intelligence based system to identify the medical condition prior to doctor consultation. The system for automatic interpretation of the medical test results of the individual using the artificial intelligence technology, where the portable electronic device is installed with the software application with the help of the internet or Wi-Fi connection. The adaptive configuration is linked directly to a medical database which contains the electronic health records of the individual. An individual can get the medical tests done on a regular basis, and the health records can be uploaded or automatically saved in the database, and the artificial intelligence technology can be used to automatically interpret the results of the diagnostic tests which is present in the health records, and can highlight the parameters which are abnormally high or abnormally low, and display the result to user through an audio note. A portable electronic device with an active internet connection Installation of thesoftware application developed for positive interpretation of the diagnostic tests in the health records Registration of user with the software application Creation of the database with the electronic medical records containing the diagnostic tests, previous prescriptions etc. Providing the list of symptoms which are experienced by the individual among the symptoms present in the list Analysis of the diagnostic test results by the software application to provide accurate results. i.e. the possible medical condition being experienced by the user Providing audio output to the individual disclosing the result of the diagnostic tes interpretation. Figure 1",BHADANE KISHOR V (IN); D PARAMESHACHARI B (IN); KHAN BASEEM (IN); NAYYAR ANAND DR (VN); PATIL BHUSHAN VAMANRAO (IN); PATIL PRATIK PRAVIN (IN),NAYYAR ANAND; PATIL PRATIK PRAVIN; PATIL BHUSHAN VAMANRAO; BHADANE KISHOR V; KHAN BASEEM; D  PARAMESHACHARI B,G16H10/60; G16H50/20,2,G16H10/60 (AU); G16H15/00 (AU); G16H50/20 (AU); A61B5/7264 (AU); A61B5/7282 (AU); A61B5/741 (AU); A61B5/742 (AU),7,AU2021101576A,1,2021-05-13,2021-05-13,0,0,0,0,0,0,
075908212,US201514918590A,2015-10-21,US2021145674A1,2021-05-20,['APPARATUS AND METHOD FOR ASSISTING A PATIENT FROM SITTING TO STANDING POSITION'],"A method and apparatus for assisting a patient from a sitting to standing position is disclosed, which includes: a base having caster wheels; a double scissors truss; a first motor operable to cause the double scissor truss to extend/retract vertically from the base; a first middle frame connected to the double scissor truss; a second middle frame hingedly connected to the front side of the first middle frame and is configured to be raised at an angle with the first middle frame; a seat member having a curved protrusion configured to assist the patient.",TU THANH DIEP CONG (VN); TON DUC THANG UNIV,TU THANH DIEP CONG (VN),A61G5/04; A61G5/08; A61G5/12; A61G5/14,4,"A61G5/045 (EP,US); A61G5/0858 (EP,US); A61G5/101 (EP); A61G5/1018 (EP); A61G5/1045 (EP); A61G5/124 (EP,US); A61G5/14 (EP,US); A61G2203/12 (EP); A61G2203/40 (EP); A61G2203/726 (EP)",10,US201514918590A,1,2021-05-20,2021-05-20,0,0,0,0,0,0,
075910612,KR20190131100A,2019-10-22,KR20210047988A,2021-05-03,['Manufacturing method for heat-generating fabric having excellent insulation effect'],"The present invention relates to a method for manufacturing a light-heating coating fabric having an excellent heat-generating effect and, more specifically, to a method for manufacturing a light-heating coating fabric having excellent heat-generating effect and excellent washing resistance by efficiently converting light energy such as the light of the sun into heat energy and generating heat by coating a light-heating coating composition containing a conductive metal oxide on the fabric.",HYUNDAE HI CHEM CO LTD (KR); SY VINA JSC (VN),CHAE WON SUK; SHIN MIN CHEOL; PATK HYUN JU; KIM JUNG HEON; KIM SOO JEONG,D06C7/00; D06M11/44; D06M11/45; D06M11/46; D06M11/47; D06M11/48; D06M11/79,7,D06C7/00 (KR); D06M11/44 (KR); D06M11/45 (KR); D06M11/46 (KR); D06M11/47 (KR); D06M11/485 (KR); D06M11/79 (KR); D10B2501/04 (KR); D10B2503/02 (KR); D10B2505/18 (KR),10,KR20190131100A,1,2021-05-03,2021-05-03,0,0,0,0,0,0,
075911239,AU2021101582A,2021-03-27,AU2021101582A4,2021-05-20,['IOT BASED GAS LEAKAGE PREVENTION SYSTEM'],"An IOT based gas leakage prevention system is disclosed. A sensor module (106) is provided and is coupled to a knob (104) of a gas stove (102), wherein said sensor module (106) consists of a weight sensor (108) which is configured to detect a weight being placed over said stove (102) for cooking, and a gas sensor (110) which is coupled to said knob (104) of said stove (102) and is configured to detect an unwanted smell of gas during said cooking process. A camera device (114) is configured to detect a user standing within a specific distance from said stove (102). An alarm module (116) is configured to alert said user when said sensor module (106) detects said unwanted smell of gas. A user interface (118) is provided to remotely control the on and off stove by receiving signals from sensor module and camera device via a communication channel. detecting a weight being placed over a gas stove by a sensor module operatively coupled to a knob of said gas stove detecting an unwanted smell near said gas stove by a gas sensor which is coupled to said knob of said stove and is configured to transmit said unwanted smell of gas during said cooking process in form of an input signal to said knob recording a presence of user within a specific distance from said stove by a recordingunit operatively coupled to said stove and wired and/or wirelessly coupled to said sensor module 206 transmitting said signal from said sensor module to said knob which consists of a digital display which is configured to receive signals from said sensor module and said camera device 208 controlling remotely said stove via said knob by a user interface which is communicatively and operatively coupled to said knob and said sensor module via a communication channel 210 alerting nearby user by an alarm module coupled to said sensor module and said user interface",BAGGA JASPAL (IN); MIRI ROHIT (IN); MISHRA DEVESH (IN); MOHIDDIN MD KHAJA (IN); NAYYAR ANAND (VN); PINJARKAR LATIKA (IN); SARITHA S K (IN); SHARAFF AAKANKSHA DR (IN); SHARMA ABHISHEK (IN); SHARMA SURAJ (IN),PINJARKAR LATIKA; SHARAFF AAKANKSHA; SHARMA SURAJ; SARITHA S K; MOHIDDIN MD KHAJA; MIRI ROHIT; BAGGA JASPAL; SHARMA ABHISHEK; MISHRA DEVESH; NAYYAR ANAND,F24C3/12; G08B21/14; G16Y10/35,3,F24C3/122 (AU); G08B21/14 (AU); G16Y10/35 (AU); G01N33/225 (AU); G16Y40/50 (AU),5,AU2021101582A,1,2021-05-20,2021-05-20,0,0,0,0,0,0,
075971540,US201715607431A,2017-05-27,US11191690B2,2021-05-27,['DEVICE AND METHOD FOR A PORTABLE PRONE SURGICAL POSITIONING'],"A method and a portable prone surgical positioning device are provided which includes: a base frame assembly having a length varying assembly; a pair of chest supporting frames for a patient to lay in prone position thereupon; a width varying assembly connected to the pair of chest supporting frames; and a curvature varying assembly, connected to the base frame assembly and the width varying assembly, operable to change a curvature of the pair of chest supporting frames.",TON DUC THANG UNIV (VN); TU CONG THANH DIEP (VN); TON DUC THANG UNIV (VN),TU CONG THANH DIEP (VN); TU CONG THANH DIEP (VN),A61G13/02; A61G13/10; A61G13/12,3,"A61G13/02 (US); A61G13/105 (US); A61G13/122 (EP,US); A61G13/1225 (US); A61G13/129 (EP,US); A61G13/1295 (US); A61G13/0054 (EP); A61G13/1235 (US); A61G2200/325 (EP)",9,US201715607431A,1,2021-05-27,2021-12-07,7,0,0,0,0,0,
075981740,VN2020000010W,2020-11-20,WO2021102484A1,2021-05-27,"['BIOLOGICAL TREATMENT APPARATUS, CARRIER CAPTURING DEVICE FOR BIOLOGICAL TREATMENT APPARATUS, WATER TREATMENT METHOD AND METHOD OF MODIFYING BIOLOGICAL TREATMENT APPARATUS']","The present invention aims at providing a biological treatment apparatus that can limit the number of carriers that adhere to a screen. Biological treatment apparatus (2) has bioreactor (2A) in which carriers flows, wherein the carriers immobilize microbes for biological treatment of water to be treated, partition wall (18) that is provided in bioreactor (2A), wherein partition wall (18) separates bioreactor (2A) into first region (19) that includes supply portion (22) for the water to be treated and second region (20) that is in communication with first region (19) at the lower part of bioreactor (2A), wherein exit portion (25) for treated water that has been treated by bioreactor (2A) is only formed in the upper part of second region (20). The apparatus further comprises carrier capturing device (26) having screen (27) that is provided at exit portion (25), wherein, screen (27) prevents the carriers from flowing out of bioreactor (2A).",ORGANO VIETNAM CO LTD (VN),DO BANG CONG NGHIEP (VN); NGUYEN VAN HOP (VN); MEGURO HIROAKI (JP),C02F3/08; C02F3/28; C02F3/30; C02F3/34,4,C02F3/12 (EP); C02F3/2806 (EP); C02F3/305 (EP); C02F2003/001 (EP); Y02W10/10 (EP),5,TW109140646A; VN2020000010W,2,2021-05-27,2021-08-01,3,0,0,0,0,0,
075981740,TW109140646A,2020-11-20,TW202128570A,2021-08-01,"['Biological treatment apparatus, carrier capturing device for biological treatment apparatus, water treatment method and method of modifying biological treatment apparatus']","The present invention aims at providing a biological treatment apparatus that can limit the number of carriers that adhere to a screen. Biological treatment apparatus 2 has bioreactor 2A in which carriers flows, wherein the carriers immobilize microbes for biological treatment of water to be treated, partition wall 18 that is provided in bioreactor 2A, wherein partition wall 18 separates bioreactor 2A into first region 19 that includes supply portion 22 for the water to be treated and second region 20 that is in communication with first region 19 at the lower part of bioreactor 2A, wherein exit portion 25 for treated water that has been treated by bioreactor 2A is only formed in the upper part of second region 20. The apparatus further comprises carrier capturing device 26 having screen 27 that is provided at exit portion 25, wherein, screen 27 prevents the carriers from flowing out of bioreactor 2A.",ORGANO VIETNAM CO  LTD (VN),DO BANG CONG NGHIEP (VN); NGUYEN VAN HOP (VN); MEGURO HIROAKI (JP),C02F3/08; C02F3/16,2,C02F3/12 (EP); C02F3/2806 (EP); C02F3/305 (EP); C02F2003/001 (EP); Y02W10/10 (EP),5,TW109140646A; VN2020000010W,2,2021-05-27,2021-08-01,3,0,0,0,0,0,
076036350,TW109215859U,2020-11-30,TWM609575U,2021-03-21,['Multi-layer structure'],本新型提供一種複層結構，包含第一融噴布、第二融噴布以及中間層。第二融噴布連接第一融噴布，中間層設置於第一融噴布及第二融噴布之間。中間層包含複數個紡織廢料，各紡織廢料之間具有縫隙，其中第一融噴布及第二融噴布為熱融材質，受熱後，第一融噴布及第二融噴布透過縫隙彼此連接。藉此，紡織廢料可在低成本的條件下，有效地重新利用，並可充分地展現其原始樣貌的結構細節。,PAIHONG VIETNAM COMPANY LTD (VN); VIETNAM PAIHO LTD (VN),HSU PI-CHU (TW); WANG GUEY-HUEI (TW); CHU SHU-SHENG (TW); TSENG KUAN-YU (TW),B32B5/22; D01F13/00,2,Y02P70/62 (EP),1,TW109215859U,1,2021-03-21,2021-03-21,0,0,0,0,0,0,
076036703,TW109215874U,2020-12-01,TWM608718U,2021-03-01,['Shoe pad'],一種鞋墊，適用於放置於一鞋底上，該鞋墊包含一承載層及一一貼覆層。該承載層具有一適用於面向該鞋底的底面，並包括一基底，及多個散布並分別包覆於該基底中的顆粒，該等顆粒的製成材質為由聚氨酯、乙烯-醋酸乙烯酯共聚物、聚氯乙烯、聚烯烴類彈性體、熱塑性彈性體、合成橡膠及天然橡膠、布料組成的物質群中選擇的至少一種物質。該貼覆層結合於該承載層上，並適用於與該鞋底間隔，該貼覆層包括一回收布料層體。利用該等顆粒及該貼覆層結合於該承載層上的設計，使該鞋墊不僅維持預定結構強度，還兼具環保的優點。,FORCE TECH CO  LTD (KY); VIETNAM PAIHO LTD (VN); PAIHONG VIETNAM COMPANY LTD (VN),YUAN SHAO-TING (TW); CHEN GUAN-LONG (TW); WU YI-DE (TW); XU BI-ZHU (TW); WANG GUI-HUI (TW); ZHU SHU-SHENG (TW); ZENG GUAN-YU (TW),A43B17/00; B32B9/00,2,,0,TW109215874U,1,2021-03-01,2021-03-01,0,0,0,0,0,0,
076076231,EP21175447A,2021-05-21,EP4093076A1,2022-11-23,"['METHOD, MOBILE EQUIPMENT, AND SYSTEM FOR VULNERABILITY DETECTION AND PREVENTION IN A SIM, AND STORAGE MEDIA']","The present invention refers to a method, a mobile equipment, and a system for vulnerability detection and prevention in a SIM. The method comprises generating a vulnerability detection and prevention unit located in a secure processing region that is independent of an application processor and a baseband processor; receiving events, data, and instructions, wherein the events, data, and instructions are sent from the SIM to the baseband processor or the application processor, or sent from the baseband processor or the application processor to the SIM; analyzing the received events, data, and instructions to determine whether the events, data, or instructions are associated with predetermined SIM vulnerabilities; and stopping the sending of the events, data, or instructions from the SIM or to the SIM in response to determining that the events, data, or instructions are associated with predetermined SIM vulnerabilities.",G INNOVATIONS VIET NAM JOINT STOCK COMPANY (VN),PHAM TUAN VUONG (VN); NGUYEN DUC MINH (VN); MAI HUY TOAN (VN),G06N20/00; H04W12/30; H04W4/50; H04W4/60,4,H04L63/14 (EP); H04W12/35 (EP); H04W4/50 (EP); H04W4/60 (EP); G06N20/00 (EP),5,EP21175447A; IB2022054726W,2,2022-11-23,2022-11-24,0,0,0,0,0,0,
076091384,US202017087535A,2020-11-02,US11057460B2,2021-06-03,['Weighted load balancing method on data access nodes'],"The weighted load balancing method on data access nodes ensures the ability to horizontally scale the data access system, the load handling capacity of the system is increased linearly according to the number of data access nodes. The proposed method includes the following steps: step 1: update the routing table, when adding, removing nodes or changing nodes' weight, move virtual nodes from node having decreased number of virtual nodes to node having increased number of virtual nodes; step 2: store old routing table on array A<hi rend=""subscript"">1 </hi>and new routing table on array A<hi rend=""subscript"">2</hi>; step 3: block access to records that need to be moved; step 4: copy records from old node to node; step 5: perform read/write access using data partitioning method with new routing table A<hi rend=""subscript"">2</hi>; step 6: clean duplicated records.",VIETTEL GROUP (VN); VIETTEL GROUP (VN),DOAN PHI HUNG (VN); DO HOANG DUONG (VN); NGUYEN TIEN DONG (VN); DOAN PHI HUNG (VN); DO HOANG DUONG (VN); NGUYEN TIEN DONG (VN),H04L29/08,1,H04L45/586 (EP); H04L45/7453 (EP); H04L47/125 (EP); H04L67/1023 (US); H04L67/1031 (US); H04L67/1095 (US),6,US202017087535A,1,2021-06-03,2021-07-06,1,0,0,0,0,0,
076092028,US201715482795A,2017-04-09,US2021161356A1,2021-06-03,['DEVICE AND METHOD FOR WASHING DRINKWARE'],"A method and device for cleaning drinkware without using electricity are disclosed including a handle, a shaft connected to the handle, a cleaning brush connected to the shaft, and a top section connected to the cleaning brush; when the interior bottom of a drinkware is pressed down, creating a pressure upon the top section, the cleaning brush is rotated in a first direction, and when the pressure decreases, the cleaning brush rotates in a second direction opposite to the first direction.",LUU TOAN VAN (VN); NGUYEN TRUNG THOI (VN); TON DUC THANG UNIV,LUU TOAN VAN (VN); NGUYEN TRUNG THOI (VN),A46B13/00; A46B13/02; A46B13/04; A47L15/00,4,"A46B13/001 (EP,US); A46B13/026 (EP,US); A46B13/04 (EP,US); A47L15/0068 (US); A47L17/00 (EP); A46B2200/3033 (EP); A47L15/4278 (US); A47L15/4418 (US)",8,US201715482795A,1,2021-06-03,2021-06-03,0,0,0,0,0,0,
076092264,US201916699777A,2019-12-02,US11426714B2,2021-06-03,['METAL ORGANIC FRAMEWORKS (MOFs) AND METHODS OF SYNTHESIZING AND USING THE SAME'],A new metal organic framework (MOF) series and method of synthesizing the same are disclosed which includes an organic linking ligand having the formula:,NGUYEN PHUONG THI KIEU (VA); LUONG QUANG THIEN (VN); PHAN THANG BACH (VN); TRAN Y BACH NHU (VA); CENTER FOR INNOVATIVE MAT AND ARCHITECTURES (VN); VIETNAM NATIONAL UNIV HO CHI MINH CITY (VN); NGUYEN PHUONG THI KIEU (VN); LUONG QUANG THIEN (VN); PHAN THANG BACH (VN); TRAN Y BACH NHU (VN); VIETNAM NATIONAL UNIV HO CHI MINH CITY (VN); CENTER FOR INNOVATIVE MAT AND ARCHITECTURES (VN),NGUYEN PHUONG THI KIEU (VA); LUONG QUANG THIEN (VN); PHAN THANG BACH (VN); TRAN Y BACH NHU (VA); NGUYEN PHUONG THI KIEU (VN); LUONG QUANG THIEN (VN); PHAN THANG BACH (VN); TRAN Y BACH NHU (VN),B01J20/22; B01J20/28; B01J20/30; B01J31/16; B01J35/10; B01J37/08; B01J31/10,7,"B01J20/226 (EP,US); B01J20/28083 (EP,US); B01J20/3085 (EP,US); B01J31/1691 (US); B01J35/647 (US); B01J37/08 (US); C07C65/105 (EP); B01J2231/34 (EP,US); B01J2531/0216 (EP); B01J2531/16 (EP,US); B01J2531/22 (EP); B01J2531/26 (EP,US); B01J2531/842 (EP,US); B01J2531/845 (EP,US); B01J2531/847 (EP,US); B01J31/1691 (EP); B01J31/2239 (EP)",17,US201916699777A,1,2021-06-03,2022-08-30,14,0,0,0,0,0,
076160059,SE2050334A,2020-03-26,SE2050334A1,2021-06-01,['Direct heating and/or self heating micro gas sensor'],"Abstract The invention relates to gas sensing devices and systems comprising a thin film gas sensing element and a thin film heater, provided on a thermally and electrically isolating substrate. The heater element extends between two heater element terminals and the gas sensing element is at one end connected to a gas sensing element terminal and at the other end connected to the heater element. ",HANOI UNIV OF SCIENCE AND TECHNOLOGY (VN); HANOI UNIV OF SCIENCE AND TECHNOLOGY (VN),MANH HUNG CHU (VN); MINH HUNG NGUYEN HUGO (SE); DUC HOA NGUYEN (VN); VAN DUY NGUYEN (VN); VAN TOAN NGUYEN (VN); MANH HUNG CHU (VN); MINH HUNG NGUYEN HUGO (SE); DUC HOA NGUYEN (VN); VAN DUY NGUYEN (VN); VAN TOAN NGUYEN (VN),G01N27/12,1,G01N27/12 (SE); G01N33/0009 (SE),2,SE2050334A,1,2021-06-01,2021-06-01,0,0,0,0,0,0,
