familyNumber,applicationNumber,applicationDate,publicationNumber,publicationDate,patentName,abstract,applicant,inventor,IPC,IPC_count,CPC,CPC_count,familyMembers (appNum),geographicalExtensions,familyDates_min,familyDates_max,timeDifference,backwardCitationsESpaceRaw,backwardCitationsESpaceA,backwardCitationsESpaceB,backwardCitationsGoogle,forwardCitationsGoogle,publicationNumberGoogle
066633472,US201815744790A,2018-01-08,US10431174B2,2019-05-30,"['PIXEL DRIVING STRUCTURE, DISPLAY PANEL AND DISPLAY DEVICE']","The present disclosure discloses a pixel driving structure, a display panel and a display device. The structure includes a pixel combination formed by a first pixel unit and a second pixel unit, a scan line, a data line, a gate driver and a source driver. The first pixel unit of the odd row pixel combination is connected to one odd row scan line, the second pixel unit of the odd row pixel combination is connected to the next even row scan line of the odd row scan line; the first pixel unit of the even row pixel combination is connected to the next two even row scan lines of the odd row scan line, the second pixel unit is connected to the next odd row scan line of the odd line scan line, the first pixel unit and the second pixel unit are connected to the same data line.",SHENZHEN CHINA STAR OPTOELECTRONICS SEMICONDUCTOR DISPLAY TECH CO LTD (VN); SHENZHEN CHINA STAR OPTOELECTRONICS SEMICONDUCTOR DISPLAY TECH CO LTD (CN),WU YU (CN); WU YU (CN),G02F1/133; G02F1/1362; G09G3/36; H01L27/32,4,"G02F1/13306 (US); G02F1/136286 (US); G09G3/20 (US); G09G3/3614 (EP); G09G3/3648 (EP,US); G02F1/1362 (EP,US); G09G2300/0426 (EP); G09G2300/0465 (EP); G09G2320/028 (EP); H10K59/131 (EP,US)",10,US201815744790A,1,2019-05-30,2019-10-01,5,0,0,0,0,0,
066633831,US201816202090A,2018-11-28,US2019162599A1,2019-05-30,['MECHANISM AND METHOD FOR FOCUSING OPTICAL SYSTEM USING GEAR AND TIMING BELT'],"The invention proposes a mechanism and method of focusing for optical systems by gear and timing belt. In particular, the focusing mechanism for the optical system by gear and timing belt consists of the following components: the optical front cover module (including the first lens element, the middle lens element, the mechanical of front cover); The optical rear cover module (including last lens element, mechanical of rear cover); The focusing mechanism (including adjustment ring, radial shaft seal, transmission shaft, timing pulley, timing belt, ball bearing, large gear); The protection and mounting mechanical system (including mechanical protection cover, internal mounting mechanical system). The method of focusing for the optical system by mean of gear and timing belt consists of the following steps: Step 1: Integrating the mechanism into the mechanical of the system; Step 2: Adjusting the final lens element; Step 3: Identifying the most convergent position of the optical system.",VIETTEL GROUP (VN),TA HONG NAM (VN); NGUYEN VAN THO (VN),G01J5/02; G01J5/08; G02B7/10; G02B7/28,4,"G01J5/0265 (EP,US); G01J5/0806 (EP,US); G01J5/084 (EP,US); G02B7/04 (EP,US); G02B7/10 (US); G02B7/28 (US); G01J5/0205 (EP,US)",7,US201816202090A,1,2019-05-30,2019-05-30,0,0,0,0,0,0,
066633832,US201816198822A,2018-11-22,US2019165923A1,2019-05-30,['METHOD OF DATA TRANSMISSION IN HALF DUPLEX CHANNEL FOR INTERNET PROTOCOL APPLICATIONS'],"A new method to transmit data of IP applications over half-duplex channel. More precisely, this method makes it possible to run IP applications (such as e-mail, web . . . ) based on low speed, half-duplex channel (VHF, HF . . . ).",VIETTEL GROUP (VN),NGUYEN HOANG ANH (VN); NGUYEN VIET HOANG (VN); NGUYEN THAI BINH (VN),H04L12/26; H04L29/06; H04L29/12; H04L5/16,4,"H04L43/028 (EP,US); H04L5/16 (US); H04L61/5007 (US); H04L69/16 (US); H04L69/168 (EP,US); H04L5/16 (EP)",6,US201816198822A,1,2019-05-30,2019-05-30,0,0,0,0,0,0,
066633833,US201816198967A,2018-11-23,US10802130B2,2019-05-30,['MARINE TARGET DETECTION IN CLUTTERED ENVIRONMENTS'],Method of slowly moving target detection with application for coastal surveillance radars. This method improves the well know other methods and efficiently detects targets with a high accuracy. The proposed method consists of three steps that are: step of generation and processing of signals with complex modulation; step of target clustering and step of detection of slowly moving targets in clutter environments.,VIETTEL GROUP (VN); VIETTEL GROUP (VN),LUU HOAI NAM (VN); TRAN VU HOP (VN); DONG XUAN HOANG (VN); NGUYEN DUC DUONG (VN); LE TRUNG DUC (VN); LUU HOAI NAM (VN); TRAN VU HOP (VN); DONG XUAN HOANG (VN); NGUYEN DUC DUONG (VN); LE TRUNG DUC (VN),G01S13/524; G01S7/41,2,"G01S13/5244 (EP,US); G01S13/5246 (EP,US); G01S13/5248 (EP,US); G01S7/414 (EP,US)",4,US201816198967A,1,2019-05-30,2020-10-13,17,0,0,0,0,0,
066634664,US201715824159A,2017-11-28,US2019159538A1,2019-05-30,['ARTIFICIAL EYELASHES AND METHOD OF MANUFACTURING THE SAME'],"Disclosed are artificial eyelashes including a first shape a first shape formed by cutting out a plurality of first strands integrated with a first base portion connected to one end of the first strands to support the first strands from a first plastic sheet having a certain thickness and a second shape formed by cutting out a plurality of second strands integrated with a second base portion connected to one end of the second strands to support the second strands from a second plastic sheet having a certain thickness. Here, one surface of the first base portion is adhered to one surface of the second base portion.",M&C ELECTRONICS VINA COMPANY LTD (VN),ROH CHUNG HYUN (VN); SEO JEO HOON (VN),A41G5/02; B23K26/38; B23K26/402,3,"A41G5/02 (EP,US); B23K26/38 (US); B23K26/402 (US)",3,US201715824159A,1,2019-05-30,2019-05-30,0,0,0,0,0,0,
066641539,VN2019000006W,2019-04-17,WO2019204834A2,2019-10-24,['HOISTING SYSTEM FOR ON-SITE FIREFIGHTING AND RESCUE FOR HIGH-RISE BUILDINGS'],"Disclosed a hoisting system for on-site firefighting and rescure for high-rise building, comprising: a guide rail system (10) disposed on the floor (2) of the top of building (1); a movable robot (20) disposed movable on the guide rail system (10); a vertical guiding rope mechanism (30) disposed on the movable robot (20); the cabin 50 disposed to be movable up and down on the vertical guiding rope mechanism (30) by the cabin operating mechanism (40); a hoist controlling mechanism (60) to control the hoist activities and lock (brake) the cabin (50) on the vertical guiding rope mechanism (30); plurality of vertical guiding rope stretching and fixing assembly (70) arranged at predetermined positions on the ground around the building (1); and a control system to control all operations of the hoist system for on-site firefighting and rescue.",CAO MINH TUYET (VN); NGUYEN DUC DUNG (VN); CAO MINH TUYET (VN); NGUYEN DUC DUNG (VN),CAO MINH TUYET (VN); NGUYEN DUC DUNG (VN); CAO MINH TUYET (VN); NGUYEN DUC DUNG (VN),A62B1/02; A62C31/28; A62C99/00,3,A62B1/02 (EP); A62C31/28 (EP); A62C99/009 (EP),3,VN2019000006W,1,2019-10-24,2019-12-05,2,0,0,0,0,0,
066645140,US201729594729F,2017-02-22,USD850378S,2019-06-04,['Wind collector'],,NGUYEN CHI CO LTD (VN),NGUYEN LE THANH (VN),,0,,0,US201729594729F,1,2019-06-04,2019-06-04,0,0,0,0,0,0,
066691086,VN2019000009W,2019-04-25,WO2019210333A1,2019-10-31,['CHAIR WITH A HEAD AND NECK REST'],"A chair with a cavity for resting the sitter's head and neck in the backrest (well), extending from the vertebra prominens to the top of the neck which fits the head and neck of the user. This cavity is attached to the upper backrest in a groove, which allows vertical adjustment, so that the head and neck of users of different heights can be supported and functioning like a movable pillow in the upper backrest.",TRAN LUONG SON (VN),TRAN LUONG SON (VN),A47C7/38,1,A47C7/38 (EP); A47C7/383 (EP),2,VN2019000009W,1,2019-10-31,2019-10-31,0,0,0,0,0,0,
066813693,US201816198900A,2018-11-23,US11083143B2,2019-06-20,['METHOD AND SYSTEM FOR SIMULATING PLANT-GROWING ENVIRONMENT'],"A method and an environment simulating system are disclosed which includes a database comprising a library of climate recipes characterizing growing environments for different plants and trees; a micro-controller electrically coupled to receive specific climate recipes when orders for different plants and trees are received from customers; an environment actuating system, electrically coupled to the micro-controller, operable to receive the specific climate recipes from the database; a sub-controller electrically coupled to receive the specific climate recipes from the micro-controller to drive the environment actuating system to generate specific growing environments in a growing enclosure in accordance with the specific orders; an array of web-based sensors, coupled to the growing enclosure and the micro-controller, operable to sense growing conditions of the specific growing environments and to feedback the growing conditions to the micro-controller; and a network server adapted to couple the Database, the micro-controller, the sub-controller, the array of web-based sensors, the growing enclosure, and the customers to a network.",TREANT PROTECTOR PTE LTD (SG); TREANT PROTECTOR VIETNAM COMPANY LTD (VN),PHAM TUAN ANH (VN); TRUONG PHU NGOC (VN); DAO NGOC BAO (VN); PHAM TUAN ANH (VN); TRUONG PHU NGOC (VN); DAO NGOC BAO (VN),A01G31/02; A01G9/02; A01G9/029; A01G31/06; A01G9/24,5,"A01G31/02 (US); A01G31/06 (EP,US); A01G9/022 (US); A01G9/0297 (US); A01G9/246 (EP,US); A01G9/247 (EP,US); A01G9/249 (EP,US); A01G2009/003 (US); A01G27/00 (US); Y02A40/25 (EP); Y02P60/21 (EP)",11,US201816198900A,1,2019-06-20,2021-08-10,26,0,0,0,0,0,
066887213,US201917419628A,2019-01-04,US11974317B2,2022-03-17,"['DATA TRANSMISSION METHOD AND APPARATUS, COMPUTER DEVICE, AND SYSTEM']","A data transmission method includes: sending a channel configuration message to a base station, the channel configuration message being used to indicate an access method set for one or more logical channels corresponding to a sidelink in the terminal; receiving a reconfiguration message sent by the base station, the reconfiguration message being used to indicate radio access methods corresponding to the logical channels; and sending the data in the logical channels on the sidelink according to corresponding radio access methods for the logical channels.",BEIJING XIAOMI MOBILE SOFTWARE CO LTD (VN); BEIJING XIAOMI MOBILE SOFTWARE CO LTD (CN),YANG XING (CN); YANG XING (CN),H04W72/04; H04W72/08; H04W72/52; H04W72/543,4,"H04W24/10 (EP); H04W72/52 (US); H04W72/543 (EP,US); H04W76/23 (EP); H04W88/06 (EP); H04W92/18 (EP)",6,CN2019070441W; CN201980000026A; US201917419628A,2,2019-06-04,2024-04-30,58,0,0,0,0,0,
066951635,US201715853891A,2017-12-25,US10938975B2,2019-06-27,['CLIENT-BASED MANAGEMENT OF MULTIMEDIA MESSAGES'],"A calling user initiates a telephonic communication with a receiving user by dialing a phone number of the receiving user in his or her address book. The communication is transmitted from the calling user's device to the receiving user's device through a network that is not using Internet protocol or Internet-based, e.g., Transmission Control Protocol (TCP), Internet Protocol (IP), TCP-IP, or Voice over Internet Protocol (VoIP). After a number of notifications has passed on the receiving user's device and the receiving user is not able to answer the telephonic communication, a local voicemail recorder will be activated to record and store the telephonic communication for later retrieval by the receiving user. The stored communication is identifier by a sequence of string containing at least one of a name, a telephone number, a storage location, a date-time attribute, and a duration associated with the stored communication.",NGUYEN CHI LUU NGOC (US); NGUYEN CHUONG LUU THANH (VN); NGUYEN CHI LUU NGOC (US); NGUYEN CHUONG LUU THANH (VN),NGUYEN CHI LUU NGOC (US); NGUYEN CHUONG LUU THANH (VN); NGUYEN CHI LUU NGOC (US); NGUYEN CHUONG LUU THANH (VN),H04M1/65; H04M1/663; H04M1/7243; H04M1/72433; H04M3/533; G06F16/61; H04L29/12; H04M3/42; H04W4/46,9,"G06F16/61 (US); H04M1/65 (US); H04M1/663 (US); H04M1/7243 (US); H04M1/72433 (EP); H04M3/42306 (EP,US); H04M3/53308 (EP,US); H04L61/4588 (EP,US); H04M1/65 (EP); H04M2201/36 (EP,US); H04W4/46 (US)",11,US201715853891A; US202017069791A,1,2019-06-27,2021-03-18,21,0,0,0,0,0,
066992466,AU2018051404W,2018-12-21,WO2019119071A1,2019-06-27,['SYSTEMS AND METHODS FOR REAL-TIME VIDEO STREAMING'],"Described embodiments generally relate to computer-implemented method for facilitating electronic event ticketing, the method comprising receiving at least one search criterion from a user interface; retrieving a sub-set of stored events based on the received at least one criterion; displaying the sub-set of stored events on the user interface; receiving a user selection of at least one event from the sub-set of events; displaying real-time video footage captured by a camera associated with the at least one event; and presenting the user with an option to purchase a ticket to the at least one event. Described embodiments also relate to a computing device and server system for performing the method.",BONSER KEITH WILLIAM (VN); STREAMY LTD (IE),BONSER IMRAN (VN); BONSER KEITH WILLIAM (VN),G06Q10/02; G06Q30/06,2,G06Q10/02 (AU); G06Q20/045 (EP); G06Q30/0251 (AU); G06Q30/06 (EP); G07F17/42 (EP); G07F19/207 (EP); H04N7/183 (EP); G06Q10/0631 (AU); H04L65/612 (AU),9,AU2018051404W,1,2019-06-27,2019-06-27,0,0,0,0,0,0,
067057496,US201816217762A,2018-12-12,US2019204433A1,2019-07-04,['METHOD OF TRACKING TARGET BY USING 2D RADAR WITH SENSOR'],"Embodiments of the present invention include the different methods for data fusion from multi dissimilar sensors to reduce the noise of the tracking the 3D target in Cartesian coordinates. Accuracy of this invention is precise and more stable than the conventional methods that use geometric calculations of 2D radars to track 3D targets. The results of this invention are using the same 3D radars in the tracking system. These methods are not only implemented in existing tracking centers, but also handle the tradeoff between the data transmission capacity at the command center and the computational speed of system. This invention performs the sequential steps: determining the dynamical motion model of target, state prediction and measurement update. Wherein, the variation of steps is shown in the embodiment of this invention by the following different approaches: selective measurement; parallel filtering; state vector fusion; feedback state vector fusion; measurement fusion state vector fusion.",VIETTEL GROUP (VN),BUI TANG BAO NGOC (VN); LE TRAN SU (VN); NGUYEN QUANG BANG (VN),G01S13/58; G01S13/72; G01S13/86; G01S7/42; G06T7/292,5,"G01S13/42 (EP,US); G01S13/589 (US); G01S13/723 (EP,US); G01S13/86 (EP,US); G01S3/02 (US); G01S7/42 (US); G06T7/292 (US); G01S5/0294 (EP); G01S5/12 (EP)",9,US201816217762A,1,2019-07-04,2019-07-04,0,0,0,0,0,0,
067058017,US201715859576A,2017-12-31,US10501324B2,2019-07-04,"['Systems, Devices, and/or Methods for Reactive Graphene and its Applications']","Certain exemplary embodiments can provide a system, which can comprise ink or a rubber object comprising reactive graphene. The reactive graphene comprises a graphene core that is chemically bonded with a reactive shell. The graphene core is a graphene hybrid composite comprising graphene and one or more of nanocarbon, graphene nanoplatelets, graphene oxide, reduced graphene oxide and/or pristine graphene, etc.",HK INVENT CORP (VN); HK INVENT CORP (VN),KHE NGUYEN (VN); LINH VO (VN); TRINH NGUYEN (VN); PHU NGUEYN (VN); KHANH DINH (VN); KHE NGUYEN (VN); LINH VO (VN); TRINH NGUYEN (VN); PHU NGUEYN (VN); KHANH DINH (VN),B82Y30/00; B82Y40/00; C01B32/186; C01B32/194; C01B32/198; C08K3/04; C08L7/00,7,B82Y30/00 (US); B82Y40/00 (US); C01B32/186 (US); C01B32/194 (US); C01B32/198 (US); C08K3/042 (EP); C08L7/00 (US); B82Y30/00 (EP); C01B2204/22 (US); C01B2204/24 (US); C01B2204/26 (US); C01P2004/24 (US); C08K3/042 (US),13,US201715859576A,1,2019-07-04,2019-12-10,5,0,0,0,0,0,
067145529,US201916459613A,2019-07-02,US10679844B2,2020-01-09,['OPTIMAL EXPOSURE OF A BOTTOM SURFACE OF A SUBSTRATE MATERIAL AND/OR EDGES THEREOF FOR CLEANING IN A SPIN COATING DEVICE'],"A spin coating device includes a base plate, a spin chuck on which a substrate material is placed, and an actuator mechanism to engage the base plate with the spin chuck such that the base plate synchronously spins along with the spin chuck. The substrate material includes a top surface coated with a film-forming substance and a bottom surface. The cleaning mechanism is below the base plate and out of optimal exposure to the bottom surface of the substrate material and edges thereof in a state of the base plate engagement. In response to disengagement of a lid configured to synchronously co-rotate with the base plate, the actuator mechanism is further configured to disengage the base plate from the spin chuck and to enable the optimal exposure of the cleaning mechanism to the bottom surface of the substrate material and the edges thereof.",TRUONG THANH (VN); DANG TRI (VN); TRAN TU (VN); NGUYEN HIEU CHARLIE (US); TRUONG THANH (VN); DANG TRI (VN); TRAN TU (VN); NGUYEN HIEU CHARLIE (US); C&D SEMICONDUCTOR SERVICES INC (US),TRUONG THANH (VN); DANG TRI (VN); TRAN TU (VN); NGUYEN HIEU CHARLIE (US); TRUONG THANH (VN); DANG TRI (VN); TRAN TU (VN); NGUYEN HIEU CHARLIE (US),B08B3/02; G03F7/16; H01L21/02; B05C11/08; H01L21/67; H01L21/687,6,"B05C11/08 (US); B08B3/02 (US); B08B3/022 (US); G03F7/16 (CN); G03F7/162 (EP,US); G03F7/168 (EP); H01L21/02043 (KR); H01L21/02087 (US); H01L21/0209 (US); H01L21/02282 (KR,US); H01L21/0273 (KR); H01L21/67028 (KR); H01L21/67051 (EP,US); H01L21/6715 (EP,KR); H01L21/68764 (KR,US); H01L21/68785 (US)",16,CA3048529A; CN201910616900A; EP19183277A; JP2019127553A; KR20190080551A; TW108124089A; US201916459613A; US202016865433A; US202016865438A,7,2020-01-09,2022-11-08,34,0,0,0,0,0,
067145529,US202016865433A,2020-05-04,US11239070B2,2020-08-20,['OPTIMAL EXPOSURE OF A BOTTOM SURFACE OF A SUBSTRATE MATERIAL AND/OR EDGES THEREOF FOR CLEANING IN A SPIN COATING DEVICE'],"A method includes rendering a cleaning nozzle of a spin coating device below a base plate and out of optimal exposure to a bottom surface and edges of a substrate material placed on a spin chuck in a state of engagement of the base plate with the spin chuck, and rendering the base plate completely under the spin chuck even in the aforementioned state of engagement. In response to disengagement of a lid from the base plate, the method also includes disengaging the base plate from the spin chuck to lower the base plate to a locking point whereupon a portion of the cleaning nozzle below the base plate passes through a hole in the base plate and emerges completely out of and above the base plate, and cleaning the bottom surface and/or the edges of the substrate material utilizing the cleaning nozzle based on an optimal exposure thereof.",TRUONG THANH (VN); DANG TRI (VN); TRAN TU (VN); NGUYEN HIEU CHARLIE (US); TRUONG THANH (VN); DANG TRI (VN); TRAN TU (VN); NGUYEN HIEU CHARLIE (US),TRUONG THANH (VN); DANG TRI (VN); TRAN TU (VN); NGUYEN HIEU CHARLIE (US); TRUONG THANH (VN); DANG TRI (VN); TRAN TU (VN); NGUYEN HIEU CHARLIE (US),B05C11/08; B08B3/02; G03F7/16; H01L21/02; H01L21/67; H01L21/687,6,"B05C11/08 (US); B08B3/02 (US); B08B3/022 (US); G03F7/16 (CN); G03F7/162 (EP,US); G03F7/168 (EP); H01L21/02043 (KR); H01L21/02087 (US); H01L21/0209 (US); H01L21/02282 (KR,US); H01L21/0273 (KR); H01L21/67028 (KR); H01L21/67051 (EP,US); H01L21/6715 (EP,KR); H01L21/68764 (KR,US); H01L21/68785 (US)",16,CA3048529A; CN201910616900A; EP19183277A; JP2019127553A; KR20190080551A; TW108124089A; US201916459613A; US202016865433A; US202016865438A,7,2020-01-09,2022-11-08,34,0,0,0,0,0,
067218700,SE2019050023W,2019-01-15,WO2019139537A1,2019-07-18,['IMPROVED BIOSENSOR AND METHOD FOR MANUFACTURING SUCH'],"An electrochemical biosensor is provided. The biosensor comprises at least one conductive nanomaterial (10) operatively connected to at least one electrode (12); and a catalyst (16) for a reduction and/or oxidation reaction of said nanomaterial (10). Further, a method for manufacturing an electrochemical biosensor (1) is provided. The method (100) comprises the steps of: depositing (110) a first conducting nanomaterial (10) onto a first electrode (12); and adding (130) a catalyst (16) for a reduction and/or oxidation reaction of said nanomaterial (10).",RUZGAS TAUTGIRDAS (SE); ARNEBRANT THOMAS (SE); SOTRES JAVIER (SE); LAIWATTANAPAISAL WANIDA (TH); GONZALEZ JUAN FRANCISCO (SE); SHAFAAT ATEFEH (IR); DUC PHAM ANH (VN); LARPANT NUTCHA (TH),RUZGAS TAUTGIRDAS (SE); ARNEBRANT THOMAS (SE); SOTRES JAVIER (SE); LAIWATTANAPAISAL WANIDA (TH); GONZALEZ JUAN FRANCISCO (SE); SHAFAAT ATEFEH (IR); DUC PHAM ANH (VN); LARPANT NUTCHA (TH),B82Y15/00; B82Y30/00; G01N27/02; G01N27/22; G01N27/327,5,B82Y15/00 (EP); G01N27/327 (EP),2,SE2019050023W,1,2019-07-18,2019-07-18,0,0,0,0,0,0,
067226302,IB2019054256W,2019-05-23,WO2019224753A1,2019-11-28,['SMARTPHONE CASE OR HOLDER WITH ELASTIC STRUCTURE AND AUXILIARY DEVICES TO ALLOW USER GO HAND-FREE ON THEIR SMARTPHONES'],"Smartphone case or holder with elastic structure and easy to manufacture in seamless form consists of elastic groove holding the smartphone's side. The width of the groove can be adjusted as it is capable of stretching horizontally. Such groove has cross section of Ω, ω, Σ, M, C or U shape, in which U shaped cross section includes at least one edge on the inside of each end; or a groove can be made of 2 side bars and a bottom bar, in which 2 side bars are rectangle bars or comb-shaped long rectangle bars with many comb teeth and the bottom bar is made of thin slabs connecting to lower edges of the two side bars. The bottom bars have curved-shape, such as C, U, S, Ω, ω letters or sine shape or they are in the form of folded lines, such as N, M, W, V, X letter or Zigzag shape. There is a connector or a joint attaches to bottom edges of the grooves to form a smartphone holder that is capable of attaching to external devices. In addition, the distance between grooves can be adjusted thanks to the fact that connecting bars between grooves are thin elastic bars with curved or folded shapes. This back case can be used as either back case or holder of smartphone to attach to external objects or devices. And the back case or holder of smartphone and its auxiliaries allow user uses go hand-free on their smartphones.",HUYNH CONG NHAN (VN),HUYNH CONG NHAN (VN); HUYNH NGUYEN PHUONG UYEN (VN); HUYNH CONG NGHIA (VN),A45C11/00; A45F5/00; A45F5/02,3,A45C11/00 (EP); A45F5/00 (EP); A45F5/021 (EP); A45C2011/002 (EP); A45F2005/008 (EP); A45F2005/025 (EP); A45F2200/0516 (EP),7,IB2019054256W,1,2019-11-28,2019-11-28,0,0,0,0,0,0,
067257923,KR20180038661A,2018-04-03,KR101995381B1,2019-07-02,['APPARATUS AND METHOD FOR CONTROLLING OF LIGHTING'],"The present invention is to perform a control operation for expressing a spectral effect of illumination through an illumination module or a light source provided at an illumination unit by making an offline controller receive spectral effect screenplay data generated by a spectral effect generation system wherein the offline controller is individually controllable via an offline medium. The present invention is to control the spectral effect of illumination expressed by the unit of an illumination unit or a light source using the offline controller being individually controllable. The offline controller includes: a spectral effect screenplay storage unit downloading, via the offline medium, and storing the spectral effect screenplay data provided by the spectral effect generation system; a signal detection unit detecting a first audio signal inputted by an audio signal input unit provided in the offline controller and a second audio signal inputted by a moving signal input unit; a signal switching unit selecting one between the first and second audio signals detected by the signal detection unit to mix the selected audio signal with the spectral effect screenplay data; a balance matching unit, if one audio signal is selectively switched by the signal switching unit, matching the spectral effect screenplay data according to an output level size of the switched audio signal to balance the spectral effect screenplay data; and a control unit outputting a control signal to express the spectral effect of illumination by the unit of the illumination module or the light source by the spectral effect screenplay data matched by the balance matching unit.",JANG JUNG HYUN (KR); BUI VIET HOANG (VN),JANG JUNG HYUN (KR); BUI VIET HOANG (VN),G09G3/34; G09G5/12; H05B37/02,3,G09G3/3406 (KR); G09G5/12 (KR),2,KR20180038661A,1,2019-07-02,2019-07-02,0,0,0,0,0,0,
